Food,Serving Size,Gallons,Litres,Category,Information
Chocolate,4,516,1953,other,"The water footprint of chocolate varies depending on where and how the cocoa (or cacao) trees and other ingredients were grown. Chocolate ingredients are almost entirely rainfed (green water), receive little irrigation (blue water) and require some fertilizer and pesticides that cause water pollution (grey water). There is also water pollution associated with processing, packaging and transporting chocolate."
Almonds,4,483,1828,other,"Almond trees thrive in semi-arid Mediterranean climates, are primarily rainfed (green water), can require significant amounts of irrigation (blue water) and can cause water pollution from the application of fertilizer and/or pesticides (grey water)."
Beef,4,463,1753,meat,"Cattle tend to have long lives and eat large amounts of grass and/or grain. Most US cattle eat grass for the majority of their lives and are finished in feedlots where they are given feed made from corn, hay and leftover distiller's grain. These crops are predominantly rainfed (green water), however feed grain crops are increasingly being irrigated (blue water). Beef production can cause water pollution (grey water) from large concentrations of manure leaching into soil and from fertilizer and/or pesticides used to grow feed crops running off into waterways."
Cashews,4,427,1616,other,Cashew trees are tropical evergreens that rely almost entirely on rainfall (green water) and can receive supplemental irrigation (blue water).
Pistachios,4,341,1291,other,"Pistachio trees grow in warm, Mediterranean climates where they are primarily irrigated (blue water) in addition to being rainfed (green water), and can cause water pollution from the application of fertilizer and/or pesticides (grey water)."
Hazelnuts,4,316,1196,other,"Hazelnuts grow on shrubs or as single-stem trees in moderate climates where they are mainly rainfed (green water), can require a significant amount of irrigation (blue water) and can cause water pollution from the application of fertilizer and/or pesticides (grey water)."
Lamb and mutton,4,313,1185,meat,"Most sheep are raised in pasture- and forage-based systems and eat grass that is predominantly rainfed (green water), although sometimes they are fed grain in feedlots. Feed grains are typically rainfed (green water) but are increasingly being irrigated (blue water). Because of the foraging diet of sheep and lambs, their production tends to cause minimal water pollution (grey water)."
Walnuts,4,279,1056,other,"Walnut trees thrive in semi-arid Mediterranean climates, are primarily rainfed (green water), can require significant amounts of irrigation (blue water) and can cause water pollution from the application of fertilizer and/or pesticides (grey water)."
Dried Apples,4,206,780,dried fruits,"Apple trees are primarily rainfed (green water) and can receive supplemental irrigation (blue water). Most apple trees are treated heavily with pesticides, and can cause water pollution (grey water) from fertilizer and/or pesticide use. 
- Dried fruits tend to have bigger water footprints than their fresh variety because of water consumption associated with processing."
Prunes,4,187,708,dried fruits,"Plum trees thrive in a warm Mediterranean climate and are primarily rainfed (green water), can receive some supplemental irrigation (blue water) and can cause water pollution from the significant application of fertilizer and/or pesticides (grey water). 
- Dried fruits tend to have bigger water footprints than their fresh variety because of water consumption associated with processing."
Pork and bacon,4,180,681,meat,"Most hogs are raised in ""industrial"" systems, in feedlots where they are fed grain made from wheat, corn, barley, oats and sorghum, although in the US the feed is often made from corn and soybeans. Feed grains are primarily rainfed (green water) but are increasingly being irrigated (blue water). Pork production can cause water pollution (grey water) from large concentrations of animal manure leaching into soils and from the fertilizer and/or pesticides used to grow feed crops running off into waterways."
Butter,4,167,632,processed foods,"Dairy cows tend to have long lives in systems where they eat large quantities of grass and feed grain made from corn and soybeans.
Dairies can also cause a significant amount of water pollution from manure leaching into waterways.
- Feed grains are predominantly rainfed (green water), although corn and soybeans are increasingly being irrigated (blue water) in some states. Butter production can cause water pollution (grey water) from processing, packaging and transportation, and when fertilizer and/or pesticides are used in feed crop production."
Goat,4,166,628,meat,"Most meat goats are raised in pasture- and forage-based systems and eat grass that is predominantly rainfed (green water) and can receive some small amount of irrigation (blue water). Because of the foraging diet of meat goats, their production tends to cause minimal water pollution (grey water)."
Quinoa,4,135,511,other,"Native to the semi-arid Andes Mountains, quinoa plants are almost entirely rainfed (green water) and can cause water pollution from the application of fertilizer and/or pesticides (grey water)."
Dried Apricots,4,133,503,dried fruits,"Apricot trees are primarily rainfed (green water), but receive significant amounts of irrigation (blue water) as they are typically produced in semi-arid regions. 
- Dried fruits tend to have bigger water footprints than their fresh variety because of water consumption associated with processing."
Chicken,4,130,492,meat,"Most chickens in the US are raised in ""industrial"" systems where they're given feed made from corn and soybeans. Most feed grains are rainfed (green water) but are increasingly being irrigated (blue water). Chicken production can cause water pollution (grey water) from large concentrations of animal manure leaching into soil and from fertilizer and/or pesticides used to grow feed crops leaching into waterways."
Turkey,4,130,492,meat,"Most turkeys in the US are raised in ""industrial"" systems where they are given feed made from corn and soybeans. Feed grains are primarily rainfed (green water) but are also increasingly being irrigated (blue water). Turkey production can cause water pollution (grey water) from large concentrations of animal manure leaching into the soil and from the fertilizer and/or pesticides used to grow feed crops running off into waterways."
Peanuts,4,119,450,other,"Peanut plants rely almost entirely on rainfall (green water), can receive some supplemental irrigation (blue water) and can cause water pollution from the application of fertilizer and/or pesticides (grey water)."
Soy burger,4,113,428,processed foods,"Veggie burgers can be made from many different ingredients; soy is used here as a stand-in. The water footprint is primarily associated with growing soybeans and other ingredients (spices, binders, etc.) required to make the burger. 
- Soybeans are mostly rainfed (green water), although in the US they are increasingly being irrigated (blue water) in some states and can cause pollution (grey water) from fertilizer and/or pesticides used to grow the soybeans and other ingredients.
- There is also pollution associated with manufacturing veggie burgers, including processing, assembly, packaging and transportation."
Figs,4,98,371,produce,Fig trees thrive in a Mediterranean climate and require regular and substantial irrigation (blue water) to augment the rain (green water) they receive.
Chicken Eggs,4,98,371,other,"In the US, most layer chickens that produce eggs are raised in ""industrial"" systems where they're given feed made from corn and soybeans. Most feed grains are rainfed (green water) but are increasingly being irrigated (blue water). Chicken (egg) production can cause water pollution (grey water) from large concentrations of animal manure leaching into the soil and from the fertilizer and/or pesticides used to grow feed crops leaching into waterways."
Cheese,4,95,360,processed foods/dairy,"Cheese production can cause pollution (grey water) because of processing, packaging and transportation, and when fertilizer and/or pesticides are used in feed crop production.
- Dairy cows tend to have long lives in systems where they eat large quantities of grass and feed grain made from corn and soybeans. Feed grains are predominantly rainfed (green water), although in the US, corn and soybean plants are increasingly being irrigated (blue water) in some states. 
- Dairies can also cause a significant amount of water pollution from manure leaching into waterways."
Olives,4,90,341,produce,"Olive trees grow in warm, Mediterranean climates where they are mainly rainfed (green water) and can require a significant amount of irrigation (blue water)."
Chestnuts,4,83,314,other,"Chestnut trees rely largely on rainfall (green water), can receive supplemental irrigation (blue water) and can cause water pollution from the application of fertilizer and/or pesticides (grey water)."
Oatmeal,4,76,288,processed foods/milled flour,"Oat plants are primarily rainfed (green water), can receive some supplemental irrigation (blue water) and can cause water pollution from the application of fertilizer and/or pesticides (grey water).
- Milled oats (like oatmeal) tend to have bigger water footprints than their primary crop because of water consumption associated with processing. "
Tofu,4,76,288,processed foods,"The water footprint of tofu is largely associated with growing soybeans. 
- Soybeans are mostly rainfed (green water), although in the US, soybeans are increasingly being irrigated (blue water) in some states. There is also pollution (grey water) associated with processing, packaging and transporting tofu, and a grey water component from fertilizer and/or pesticide use in growing soybeans."
Raisins,4,73,276,dried fruits,"Grapes vines are primarily rainfed (green water), can require supplemental irrigation (blue water) and can cause water pollution from the application of fertilizer and/or pesticides (grey water)."
White Rice,4,73,276,processed foods,"Rice plants are rainfed (green water) although most rice produced in the US is irrigated or grown in flooded fields (blue water), and it can cause water pollution from the application of fertilizer and/or pesticides (grey water).
- Like brown rice, white rice has the hull removed as well as the bran, which increases its water footprint compared to brown rice because of extra processing. "
Apple juice,8,71,269,processed foods,"The water footprint of apple juice varies depending on where and how the apples were grown. Most of the water footprint is associated with growing apple trees which are primarily rainfed (green water) and are supplemented with substantial amounts of irrigation (blue water) in drier regions. Apple trees are treated heavily with pesticides, and can cause water pollution (grey water) from fertilizer and/or pesticide use. There is also pollution associated with processing, packaging and transporting juice."
Dates,4,68,257,produce,"Date palm trees thrive in hot, arid climates and require regular irrigation (blue water) to augment the little rain (green water) they typically receive."
Black-eyed peas,4,67,254,produce,"Cowpeas include black-eyed peas and are a warm season, drought-resistant crop. Cowpea plants are primarily rainfed (green water), receive little supplemental irrigation (blue water) although irrigation will increase their productivity, and are typically grown without pesticides."
Cowpeas,4,67,254,produce,"Cowpeas include black-eyed peas and are a warm season, drought-resistant crop. Cowpea plants are primarily rainfed (green water), receive little supplemental irrigation (blue water) although irrigation will increase their productivity, and are typically grown without pesticides."
Coffee,8,66,250,processed foods,"Coffee trees are rainfed (green water) if they are shade-grown and receive significant irrigation (blue water) if they are sun-grown. They can cause water pollution from the use of fertilizer and/or pesticides (grey water) and there is a significant amount of water used in processing coffee using the wet washing method (it can also be ""dry washed""). There is also pollution associated with processing, packaging and transporting coffee."
Plums,4,65,246,produce,"Plum trees thrive in a warm Mediterranean climate and are primarily rainfed (green water), can receive some supplemental irrigation (blue water) and can cause water pollution from the significant application of fertilizer and/or pesticides (grey water)."
Asparagus,4,65,246,produce,"Asparagus plants are primarily rainfed (green water), can receive supplemental irrigation (blue water) and can cause water pollution from the use of fertilizer and/or pesticides (grey water)."
Brown Rice,4,65,246,processed foods,"Brown rice has the hull or husk removed, which increases its water footprint for processing. Rice is rainfed (green water) although most rice in the US is irrigated or grown in flooded fields (blue water), and it can cause water pollution from the application of fertilizer and/or pesticides (grey water)."
Soybeans,4,64,242,produce,"Soybeans that are grown to be eaten as food, like edamame, are a small percentage of total production. Most of the crop is grown to be heavily processed for by-products like soybean oil and meal. Soybeans plants are primarily rainfed (green water), but depending on the type of soybean and the soil conditions, they can receive supplemental irrigation (blue water) and can cause water pollution from the use of fertilizer and/or pesticides (grey water)."
Edamame,4,64,242,produce,"Soybeans that are grown to be eaten as food, like edamame, are a small percentage of total production. Most of the crop is grown to be heavily processed for by-products like soybean oil and meal. Soybeans plants are primarily rainfed (green water), but depending on the type of soybean and the soil conditions, they can receive supplemental irrigation (blue water) and can cause water pollution from the use of fertilizer and/or pesticides (grey water)."
Milk,8,64,242,dairy,"Dairy cows tend to have long lives in systems where they eat large quantities of grass and feed grains, both of which are predominantly rainfed (green water). In the US, feed grains are increasingly being irrigated (blue water) in some states and can cause water pollution (grey water) from fertilizer and/or pesticide use. Dairies can also pollute water (grey water) when concentrated animal manure leaches into waterways, and there is pollution associated with processing, packaging and transporting milk."
Orange juice,8,64,242,processed foods,"The water footprint of orange juice is mainly associated with growing oranges and varies depending on where and how the oranges were grown. Orange trees are primarily rainfed (green water), can require supplemental irrigation (blue water) and can cause pollution from the use of fertilizer and pesticides (grey water). The grey water footprint is primarily associated with processing, packaging and transporting orange juice."
Lentils,4,57,216,produce,"Lentil vines are primarily a dryland, rainfed (green water) crop, but can receive supplemental irrigation (blue water) which can increase problems with pests, and can cause a significant amount of water pollution from the use of fertilizer and/or pesticides (grey water)."
Pasta,4,56,212,processed foods/milled flour,"Dry pasta is made from specially milled wheat flour. The water footprint of pasta varies depending on where and how the wheat plants were grown. Wheat is primarily rainfed (green water) and can receive supplemental irrigation (blue water). There is pollution (grey water) associated with fertilizer and/or pesticide use in growing wheat as well as with processing, packaging and transporting wheat flour and pasta."
Wheat flour,4,55,208,processed foods/milled flour,"Milled flours tend to have bigger water footprints than their primary crop (i.e., wheat) because of water consumption associated with processing. Wheat is primarily rainfed (green water), can require some supplemental irrigation (blue water) and can cause water pollution from application of fertilizer and pesticides (grey water)."
Guava,4,54,204,produce,"Guava trees are mainly rainfed (green water), can require some supplemental irrigation (blue water) and can cause water pollution from the application of fertilizer and/or pesticides (grey water)."
Mangoes,4,54,204,produce,"Mango trees are mainly rainfed (green water), can require supplemental irrigation (blue water) although they need a dry period to flower, and can cause water pollution from the application of fertilizer and/or pesticides (grey water)."
Pigeon peas,4,54,204,produce,"Pigeon pea shrubs are a significant warm weather, drought-resistant crop that can be grown in poor soils and are primarily rainfed (green water). They can cause water pollution from the use of fertilizer and/or pesticides (grey water)."
Pizza; sauce and cheese,4,53,201,processed foods,"Pizza is made and eaten worldwide, and the water footprint varies depending on where and how the ingredients were produced. The water footprint comes from the rainfall (green water) and irrigation (blue water) requirements associated with growing wheat for the crust, tomatoes for the sauce, as well as grass and grains to feed the cows that provide milk for the cheese (which contributes the most). There is also water pollution (grey water) that comes from growing and processing the ingredients and processing, packaging and transporting the pizzas."
Dry Beans,4,49,185,produce,"Dry beans are grown on bushes or vines and are primarily rainfed (green water), but in the US they receive supplemental irrigation (blue water) and can cause a lot of water pollution from the use of pesticides (grey water)."
Cherries,4,48,182,produce,"Cherry trees are mainly rainfed (green water), can receive substantial irrigation (blue water) and can cause water pollution from the application of fertilizer and/or pesticides (grey water)."
Plantains,4,48,182,produce,Plantains and bananas are related. Plantain trees are almost entirely rainfed (green water) and receive very little irrigation (blue water).
Bread,4,48,182,processed foods,"The water footprint of bread varies depending on where and how the wheat plants were grown. Wheat is primarily rainfed (green water) and can receive supplemental irrigation (blue water). There is water pollution (grey water) associated with fertilizer and/or pesticide use in growing wheat, and there is water pollution associated with processing, packaging and transporting wheat flour and bread."
Garbanzo beans,4,41,155,produce,"Chickpea plants are a cool season, drought-tolerant crop that are primarily rainfed (green water), can receive some supplemental irrigation (blue water) in drier areas and can cause water pollution from the use of fertilizer and/or pesticides (grey water)."
Chickpeas,4,41,155,produce,"Chickpea plants are a cool season, drought-tolerant crop that are primarily rainfed (green water), can receive some supplemental irrigation (blue water) in drier areas and can cause water pollution from the use of fertilizer and/or pesticides (grey water)."
Apricots,4,39,148,produce,"Apricot trees are primarily rainfed (green water), but receive significant amounts of irrigation (blue water) as they are typically produced in semi-arid regions."
Corn flour,4,38,144,processed foods,"Corn plants are primarily rainfed (green water), are the most heavily irrigated crop (blue water) in the US and can cause significant water pollution from the heavy application of fertilizer and/or pesticides (grey water)."
Sweet Corn,4,37,140,produce,"Corn is the most irrigated crop in the US because irrigation significantly increases corn yields. Corn plants are primarily rainfed (green water), receive significant supplemental irrigation (blue water) and cause water pollution from the use of fertilizer and/or pesticides (grey water)."
Yogurt,4,36,136,processed foods/dairy,"Dairy cows tend to have long lives in systems where they eat large quantities of grass and feed grain made from corn and soybeans. Feed grains are predominantly rainfed (green water), although in the US, corn and soybeans are increasingly being irrigated (blue water) in some states. Yogurt production can cause pollution (grey water) because of processing, packaging and transportation, and when fertilizer and/or pesticides are used to grow grains for feed. Dairies can also cause a significant amount of water pollution from manure leaching into waterways."
Avocados,4,35,132,produce,"Avocado trees are primarily rainfed (green water), require a significant amount of supplemental irrigation (blue water) and can cause water pollution from the use of fertilizer and/or pesticides (grey water)."
Wine,5,35,132,processed foods,"The water footprint is mainly associated with growing the grapes and varies depending on where and how the grapes were grown. Grape vines are primarily rainfed (green water), can receive significant supplemental irrigation (blue water) and can cause pollution from the use of fertilizer and/or pesticides (grey water). The grey water footprint is primarily associated with processing, packaging and transporting wine."
Crisps,4,31,132,processed foods,"Potatoes are a root crop that is primarily rainfed (green water) and can receive supplemental irrigation (blue water). There is pollution (grey water) associated with fertilizer and/or pesticide use in producing potatoes and other ingredients as well as with processing, packaging and transporting potato chips."
Potato chips,4,31,117,processed foods,"Potatoes are a root crop that is primarily rainfed (green water) and can receive supplemental irrigation (blue water). There is pollution (grey water) associated with fertilizer and/or pesticide use in producing potatoes and other ingredients as well as with processing, packaging and transporting potato chips."
Pears,4,28,106,produce,Pear trees are primarily rainfed (green water) and receive some supplemental irrigation (blue water) as well as significant fertilizer and pesticides (grey water).
Peaches and Nectarines,4,27,102,produce,"Peach and nectarine trees are mainly rainfed (green water), receive supplemental irrigation (blue water) and can cause water pollution from the application of fertilizer and/or pesticides (grey water)."
Soft drink,8,26,98,processed foods,"Sugar-sweetened sodas are produced worldwide and in most US states either by major manufacturers or craft producers. Production includes combining sugar and flavorings to create the soft drink. The water footprint is mainly associated with the sugar used (primarily sugar beets, but also sugar cane and corn sugar) and varies depending on where and how the sugar was grown. Sugar beet plants are primarily rainfed (green water), can receive significant supplemental irrigation (blue water) and can cause pollution from the use of fertilizer and pesticides (grey water). The grey water footprint is primarily associated with processing, packaging and transporting the ingredients."
Apples,4,25,95,produce,"Apple trees are primarily rainfed (green water) and can receive supplemental irrigation (blue water). Most apple trees are treated heavily with pesticides, and can cause water pollution (grey water) from fertilizer and/or pesticide use."
Blueberries,4,25,95,produce,"Blueberry bushes tend to receive equal amounts of water from rain (green water) and irrigation (blue water), and can cause water pollution from the application of fertilizer and/or pesticides (grey water"
Artichokes,4,25,95,produce,"Artichoke plants are primarily rainfed (green water), require a significant amount of supplemental irrigation (blue water) and can cause water pollution from the use of fertilizer and/or pesticides (grey water)."
Bananas,4,24,91,produce,Banana trees are primarily rainfed (green water) and can receive supplemental irrigation (blue water).
Tangerines,4,22,83,produce,"Trees are primarily rainfed (green water), can require some supplemental irrigation (blue water) and can cause water pollution from the application of fertilizer and/or pesticides (grey water)."
Clementines,4,22,83,produce,"Trees are primarily rainfed (green water), can require some supplemental irrigation (blue water) and can cause water pollution from the application of fertilizer and/or pesticides (grey water)."
Mandarins,4,22,83,produce,"Trees are primarily rainfed (green water), can require some supplemental irrigation (blue water) and can cause water pollution from the application of fertilizer and/or pesticides (grey water)."
Broad beans,4,20,76,produce,"Fava bean plants are primarily rainfed (green water), under dry conditions require a significant amount of supplemental irrigation (blue water) and can cause water pollution from the use of fertilizer and/or pesticides (grey water)."
Lemons,4,19,72,produce,"Lemon trees are mainly rainfed (green water), can receive some supplemental irrigation (blue water) and can cause water pollution from the application of fertilizer and/or pesticides (grey water)."
Limes,4,19,72,produce,"Lime trees are mainly rainfed (green water), can receive some supplemental irrigation (blue water) and can cause water pollution from the application of fertilizer and/or pesticides (grey water)."
